{
  "schema_version": 1,
  "diagram_type": "c4",
  "meta": {
    "id": "dispatch.c4",
    "title": "Inside Dispatch",
    "subtitle": "C4 level 3: the components of the service that owns parcel state",
    "level": "component",
    "scope": "Dispatch",
    "repository": {
      "url": "https://github.com/example/relay",
      "revision": "main"
    }
  },
  "elements": [
    {
      "id": "scans_in",
      "kind": "component",
      "label": "Scan consumer",
      "technology": "Kafka listener",
      "description": "Reads parcel.scanned and orders events by when they happened, not when they arrived"
    },
    {
      "id": "state",
      "kind": "component",
      "label": "State machine",
      "technology": "Java",
      "description": "The only thing that changes a parcel's status, and refuses any move the table does not permit"
    },
    {
      "id": "attempts",
      "kind": "component",
      "label": "Attempt policy",
      "technology": "Java",
      "description": "Decides whether a failed delivery is retried tomorrow or parked for the recipient"
    },
    {
      "id": "planner",
      "kind": "component",
      "label": "Route planner",
      "technology": "Java",
      "description": "Places a parcel on a route and asks the routing engine to sequence it"
    },
    {
      "id": "handoff",
      "kind": "component",
      "label": "Partner hand-off",
      "technology": "Java",
      "description": "Sends out-of-area parcels to a partner carrier and stops tracking them"
    },
    {
      "id": "publisher",
      "kind": "component",
      "label": "Event publisher",
      "technology": "Kafka producer",
      "description": "Emits parcel.delivered, parcel.attempt-failed and parcel.exception after the state change commits"
    },
    {
      "id": "repo",
      "kind": "component",
      "label": "Parcel repository",
      "technology": "JDBC",
      "description": "The only component here that touches the database"
    },
    {
      "id": "events",
      "kind": "queue",
      "label": "Parcel events",
      "technology": "Kafka",
      "external": true,
      "description": "Where scans arrive from, and where state changes go",
      "row": 0,
      "col": 0
    },
    {
      "id": "db",
      "kind": "database",
      "label": "Relay DB",
      "technology": "PostgreSQL 15",
      "external": true,
      "description": "The parcel, route and scan tables",
      "row": 9,
      "col": 0
    },
    {
      "id": "routing",
      "kind": "container",
      "label": "Routing engine",
      "technology": "Python",
      "external": true,
      "description": "Sequences a van\u2019s stops under time windows",
      "row": 9,
      "col": 1
    }
  ],
  "boundaries": [
    {
      "id": "dispatch",
      "kind": "container",
      "label": "Dispatch",
      "contains": [
        "scans_in",
        "state",
        "attempts",
        "planner",
        "handoff",
        "publisher",
        "repo"
      ]
    }
  ],
  "relationships": [
    {
      "from": "events",
      "to": "scans_in",
      "label": "Delivers scans to",
      "technology": "Kafka",
      "style": "dashed"
    },
    {
      "from": "scans_in",
      "to": "state",
      "label": "Proposes a transition to"
    },
    {
      "from": "state",
      "to": "repo",
      "label": "Persists through"
    },
    {
      "from": "state",
      "to": "attempts",
      "label": "Asks what happens next"
    },
    {
      "from": "attempts",
      "to": "planner",
      "label": "Requests a retry stop from"
    },
    {
      "from": "planner",
      "to": "routing",
      "label": "Sequences with",
      "technology": "gRPC"
    },
    {
      "from": "planner",
      "to": "repo",
      "label": "Writes stops through"
    },
    {
      "from": "state",
      "to": "handoff",
      "label": "Delegates out-of-area parcels to"
    },
    {
      "from": "state",
      "to": "publisher",
      "label": "Emits through"
    },
    {
      "from": "publisher",
      "to": "events",
      "label": "Publishes",
      "technology": "Kafka",
      "style": "dashed"
    },
    {
      "from": "repo",
      "to": "db",
      "label": "Reads / writes",
      "technology": "SQL"
    }
  ],
  "cards": [
    {
      "title": "Why this is one service",
      "tone": "info",
      "items": [
        "Parcel state, attempt policy and route placement change together; splitting them would need a distributed transaction to stay correct.",
        "Everything grey lives outside Dispatch and is drawn only to show where the edges go."
      ]
    }
  ]
}
